{
  "schema_version": "1.0",
  "product": {
    "record_id": "PORT-069",
    "sku": "MM-ORG-013",
    "name": "Photo and postcard archive drawer divider",
    "revision": "0.1.0-draft.1",
    "lifecycle_stage": "P2 Digital print candidate",
    "root": ".."
  },
  "artifacts": {
    "description_en": {
      "path": "p2-stage/product-description.en.md",
      "sha256": "a97d7e2857c9405f3cb447050aa5d888eb4316b1cb0e7b2c4474357acfef9e5c",
      "language": "en"
    },
    "concept_image": {
      "path": "assets/concept/MM-ORG-013-concept-v1.svg",
      "sha256": "847532f659f46c3e9e31e16a64b0bc245fa83eb28861e9559f36dfc8172165fb",
      "scope": "whole-product",
      "approval_state": "approved"
    },
    "rendered_image": {
      "path": "renders/MM-ORG-013-digital-candidate.png",
      "sha256": "0e3219ac6092f9ac0d70d7c08d7475022453c5068fb1c61f63b6cb05424bdfd7",
      "basis": "current-model"
    },
    "print_set_3mf": {
      "path": "p2-stage/MM-ORG-013-0.1.0-draft.1-print-set.3mf",
      "sha256": "0c1979ac1af832a4e2a5fefef71207a4c483e08b5127ff795d0beb5aff8a67c6",
      "all_print_parts_included": true,
      "print_parts": [
        {
          "name": "divider-2000",
          "quantity": 1
        },
        {
          "name": "archive-frame",
          "quantity": 1
        },
        {
          "name": "divider-1900",
          "quantity": 1
        },
        {
          "name": "divider-1980",
          "quantity": 1
        }
      ],
      "orientation": {
        "status": "considered",
        "encoding": "embedded-slicer-project",
        "summary": "Source rotations are preserved; objects are arranged and placed on the build plate in the authored manufacturing orientation."
      },
      "supports": {
        "status": "considered",
        "mode": "disabled",
        "encoding": "embedded-slicer-project",
        "summary": "Generated support is disabled for the authored orientation; layer-level review remains required before P3."
      }
    }
  },
  "limitations": [
    "P2 is digital evidence only and is not physical, rights, safety, appearance or commercial approval.",
    "Part-list completeness is reviewed against the named candidate revision and remains subject to product-owner approval."
  ]
}
