{
  "schema_version": "1.0",
  "product": {
    "record_id": "PORT-029",
    "sku": "MM-HOB-001",
    "name": "Polygonal Dice Tower 0.1.2-g1",
    "revision": "0.1.2",
    "lifecycle_stage": "P2 Digital candidate",
    "root": ".."
  },
  "artifacts": {
    "description_en": {
      "path": "p2-stage/product-description.en.md",
      "sha256": "40107cd88998a35fa43dee201d94650e29d6f4bad0e8e48450d48fafe56347c4",
      "language": "en"
    },
    "concept_image": {
      "path": "unicorn_tower/polygonal-dice-tower-FINAL-release-0.1.2-g1/dice_tower_project/release-0.1.2-g1/concept/dice-tower-channel-shortening-concept-r0.1.2.jpg",
      "sha256": "87bacd361563b458fbb58f104a46fe434db0251e4a8a720a08e011be6b459561",
      "scope": "whole-product",
      "approval_state": "retrospective-unapproved"
    },
    "rendered_image": {
      "path": "unicorn_tower/polygonal-dice-tower-FINAL-release-0.1.2-g1/dice_tower_project/release-0.1.2-g1/reports/production-geometry-review-0.1.2-g1.jpg",
      "sha256": "e5ec670b9819d6caf47097bce83477600875129f1bede498b9ac2e39680d07c9",
      "basis": "current-model"
    },
    "print_set_3mf": {
      "path": "unicorn_tower/polygonal-dice-tower-FINAL-0.1.2-g1.3mf",
      "sha256": "c4c4936fbd084c50925fc06d987fe90189b8a1be9fc0981c081b0ed7674294a6",
      "all_print_parts_included": true,
      "print_parts": [
        {
          "name": "polygonal-dice-tower-FINAL-0.1.2-g1.stl",
          "quantity": 1
        }
      ],
      "orientation": {
        "status": "considered",
        "encoding": "embedded-slicer-project",
        "summary": "Source rotations are preserved; objects are arranged and placed on the build plate in the authored manufacturing orientation."
      },
      "supports": {
        "status": "considered",
        "mode": "enabled",
        "encoding": "embedded-slicer-project",
        "summary": "Tree/automatic support is embedded for the selected organic candidate."
      }
    }
  },
  "limitations": [
    "P2 is digital evidence only and is not physical, rights, safety, appearance or commercial approval.",
    "Part-list completeness is reviewed against the named candidate revision and remains subject to product-owner approval."
  ]
}
