{
  "schema_version": "1.0",
  "product": {
    "record_id": "PORT-112",
    "sku": "MM-ORG-043",
    "name": "MM-ORG-043 Euro circulation-coin pocket-emptying tray",
    "revision": "0.1.0",
    "lifecycle_stage": "P2 Digital candidate",
    "root": ".."
  },
  "artifacts": {
    "description_en": {
      "path": "p2-stage/product-description.en.md",
      "sha256": "742ed7982c96e35e5298d5e13303e6865777179c97801b55773ff3d2d7d38233",
      "language": "en"
    },
    "concept_image": {
      "path": "concept/concept-context-001.png",
      "sha256": "58bb1ab814091f697c2df36b16db5fdc3b010bbd018bd04551534f56f04883e1",
      "scope": "whole-product",
      "approval_state": "approved"
    },
    "rendered_image": {
      "path": "p2-stage/current-model-render.png",
      "sha256": "63ebec18ca783504c944546baac0436a0d9b1eb165aa41e4b1e3b0ac6e0892ee",
      "basis": "current-model"
    },
    "print_set_3mf": {
      "path": "p2-stage/MM-ORG-043-0.1.0-print-set.3mf",
      "sha256": "2fafa5c39beb4f16440c25dfe5126f83df0859535720d7c4f4a3ae234adfde0b",
      "all_print_parts_included": true,
      "print_parts": [
        {
          "name": "coin-tray.stl",
          "quantity": 1
        }
      ],
      "orientation": {
        "status": "considered",
        "encoding": "embedded-slicer-project",
        "summary": "Source rotations are preserved; objects are arranged and placed on the build plate in the authored manufacturing orientation."
      },
      "supports": {
        "status": "considered",
        "mode": "disabled",
        "encoding": "embedded-slicer-project",
        "summary": "Generated support is disabled for the authored orientation; layer-level review remains required before P3."
      }
    }
  },
  "limitations": [
    "P2 is digital evidence only and is not physical, rights, safety, appearance or commercial approval.",
    "Part-list completeness is reviewed against the named candidate revision and remains subject to product-owner approval."
  ]
}
