{
  "schema_version": "1.0",
  "product": {
    "record_id": "PORT-041",
    "sku": "MM-SYS-003",
    "name": "PAX Asymmetric Accessory Grid",
    "revision": "R0.2-DRAFT",
    "lifecycle_stage": "P2 Digital candidate",
    "root": ".."
  },
  "artifacts": {
    "description_en": {
      "path": "p2-stage/product-description.en.md",
      "sha256": "3ee7329a6d48ceee8d8b2e5c5868136ed340978b7516bf58bba794c74f067a80",
      "language": "en"
    },
    "concept_image": {
      "path": "p2-stage/retrospective-concept.svg",
      "sha256": "67a3d70f2fd0fa9dcac75ea5de9b0ed551d54c202104f04f848093eb1637eb82",
      "scope": "whole-product",
      "approval_state": "retrospective-unapproved"
    },
    "rendered_image": {
      "path": "previews/03_pax_asymmetric_accessory_grid.png",
      "sha256": "2e8defde132adbe7e0a5f8e884c55106bc80bd71e48c17675837b4eb48791ce2",
      "basis": "current-model"
    },
    "print_set_3mf": {
      "path": "p2-stage/MM-SYS-003-R0.2-DRAFT-print-set.3mf",
      "sha256": "b994b5b6de32f1ba386912a3c81bbd236f9d33a269f68200940ef276face89b5",
      "all_print_parts_included": true,
      "print_parts": [
        {
          "name": "03_pax_asymmetric_accessory_grid.stl",
          "quantity": 1
        }
      ],
      "orientation": {
        "status": "considered",
        "encoding": "embedded-slicer-project",
        "summary": "Source rotations are preserved; objects are arranged and placed on the build plate in the authored manufacturing orientation."
      },
      "supports": {
        "status": "considered",
        "mode": "disabled",
        "encoding": "embedded-slicer-project",
        "summary": "Generated support is disabled for the authored orientation; layer-level review remains required before P3."
      }
    }
  },
  "limitations": [
    "P2 is digital evidence only and is not physical, rights, safety, appearance or commercial approval.",
    "Part-list completeness is reviewed against the named candidate revision and remains subject to product-owner approval."
  ]
}
