{
  "schema_version": "1.0",
  "product": {
    "record_id": "PORT-033",
    "sku": "MM-PUZ-001",
    "name": "Parametric Labyrinth Gift Box",
    "revision": "UNVERSIONED-CURRENT",
    "lifecycle_stage": "P2 Digital candidate",
    "root": ".."
  },
  "artifacts": {
    "description_en": {
      "path": "p2-stage/product-description.en.md",
      "sha256": "245ee4d1bbb117367fadb76e5982c0407e3cda057c5727bef8b6af63cb167bad",
      "language": "en"
    },
    "concept_image": {
      "path": "p2-stage/retrospective-concept.svg",
      "sha256": "b176627a9a9ee87df15f24dc5e080c0bfceec5358e28bf906ab86b052e6ccdbf",
      "scope": "whole-product",
      "approval_state": "retrospective-unapproved"
    },
    "rendered_image": {
      "path": "previews/outer_maze_iso.png",
      "sha256": "10c1ef9ed94eff76a93c3f4964594114e583314cc5f099db33ce163d4700f96f",
      "basis": "current-model"
    },
    "print_set_3mf": {
      "path": "p2-stage/MM-PUZ-001-UNVERSIONED-CURRENT-print-set.3mf",
      "sha256": "d7b4062a4f6ede8b340da623d00afaf8abe1b76da482ece0244642626431f4ea",
      "all_print_parts_included": true,
      "print_parts": [
        {
          "name": "inner.stl",
          "quantity": 1
        },
        {
          "name": "outer.stl",
          "quantity": 1
        }
      ],
      "orientation": {
        "status": "considered",
        "encoding": "embedded-slicer-project",
        "summary": "Source rotations are preserved; objects are arranged and placed on the build plate in the authored manufacturing orientation."
      },
      "supports": {
        "status": "considered",
        "mode": "disabled",
        "encoding": "embedded-slicer-project",
        "summary": "Generated support is disabled for the authored orientation; layer-level review remains required before P3."
      }
    }
  },
  "limitations": [
    "P2 is digital evidence only and is not physical, rights, safety, appearance or commercial approval.",
    "Part-list completeness is reviewed against the named candidate revision and remains subject to product-owner approval."
  ]
}
