{
  "schema_version": "1.0",
  "product": {
    "record_id": "PORT-091",
    "sku": "MM-ORG-035",
    "name": "Stamp and ink-pad desk organizer",
    "revision": "0.1.0-draft.2",
    "lifecycle_stage": "P2 Digital print candidate",
    "root": ".."
  },
  "artifacts": {
    "description_en": {
      "path": "p2-stage/product-description.en.md",
      "sha256": "96a72dec06aa75c4f4ba512f2f8eac13541a724e487baf19952f7713f4ec31c0",
      "language": "en"
    },
    "concept_image": {
      "path": "assets/concept/MM-ORG-035-concept-v1.svg",
      "sha256": "322dfe284cb8ef5ca4348a7664e49ebde81e10419043e1cd4b6d6d18da8f4433",
      "scope": "whole-product",
      "approval_state": "retrospective-unapproved"
    },
    "rendered_image": {
      "path": "renders/MM-ORG-035-digital-candidate.png",
      "sha256": "e544c360cd29f15f459eec0cccd5d64a8eb4993ab089a41b5a5360239ac7e084",
      "basis": "current-model"
    },
    "print_set_3mf": {
      "path": "p2-stage/MM-ORG-035-0.1.0-draft.2-print-set.3mf",
      "sha256": "ea9943d5ba5f879163abd060b2aa28127025c5f652aebc201209684c5538839c",
      "all_print_parts_included": true,
      "print_parts": [
        {
          "name": "DRAFT-MM-ORG-035-square-cassette-0.1.0-draft.2",
          "quantity": 1
        },
        {
          "name": "DRAFT-MM-ORG-035-rectangular-cassette-0.1.0-draft.2",
          "quantity": 1
        }
      ],
      "orientation": {
        "status": "considered",
        "encoding": "embedded-slicer-project",
        "summary": "Source rotations are preserved; objects are arranged and placed on the build plate in the authored manufacturing orientation."
      },
      "supports": {
        "status": "considered",
        "mode": "disabled",
        "encoding": "embedded-slicer-project",
        "summary": "Generated support is disabled for the authored orientation; layer-level review remains required before P3."
      }
    }
  },
  "limitations": [
    "P2 is digital evidence only and is not physical, rights, safety, appearance or commercial approval.",
    "Part-list completeness is reviewed against the named candidate revision and remains subject to product-owner approval."
  ]
}
