{
  "schema_version": "1.0",
  "product": {
    "record_id": "PORT-055",
    "sku": "MM-SYS-017",
    "name": "IVAR No-Drill Side Inventory Rail",
    "revision": "R0.2-DRAFT",
    "lifecycle_stage": "P2 Digital candidate",
    "root": ".."
  },
  "artifacts": {
    "description_en": {
      "path": "p2-stage/product-description.en.md",
      "sha256": "148fd1f60e17aae6c5e3a67793d212e2f73823ddb88980623604878c2e645871",
      "language": "en"
    },
    "concept_image": {
      "path": "p2-stage/retrospective-concept.svg",
      "sha256": "f7a2619f35f4465e3ebb646eac6cfe795270d38c74287cc65e9e7cb014ec68a2",
      "scope": "whole-product",
      "approval_state": "retrospective-unapproved"
    },
    "rendered_image": {
      "path": "previews/17_ivar_no_drill_side_inventory_rail.png",
      "sha256": "242b9aec487872a7125e3bc4c2d821f0fc67f3bd225496e13abc5a06267a6afe",
      "basis": "current-model"
    },
    "print_set_3mf": {
      "path": "p2-stage/MM-SYS-017-R0.2-DRAFT-print-set.3mf",
      "sha256": "2267175400670e001bc71183ef367cfb33a25f5279f7ab2aadcfb239d46306b8",
      "all_print_parts_included": true,
      "print_parts": [
        {
          "name": "17_ivar_no_drill_side_inventory_rail.stl",
          "quantity": 1
        }
      ],
      "orientation": {
        "status": "considered",
        "encoding": "embedded-slicer-project",
        "summary": "Source rotations are preserved; objects are arranged and placed on the build plate in the authored manufacturing orientation."
      },
      "supports": {
        "status": "considered",
        "mode": "disabled",
        "encoding": "embedded-slicer-project",
        "summary": "Generated support is disabled for the authored orientation; layer-level review remains required before P3."
      }
    }
  },
  "limitations": [
    "P2 is digital evidence only and is not physical, rights, safety, appearance or commercial approval.",
    "Part-list completeness is reviewed against the named candidate revision and remains subject to product-owner approval."
  ]
}
